Question,Answer
What is the mission of Bridge of Hopes?,"To foster an inclusive learning environment where every child, regardless of their challenges, can thrive using AI-driven personalized education."
How does Bridge of Hopes support children with special needs?,By providing personalized learning experiences through an AI-driven platform that adapts to each child's unique needs.
What is the goal of Bridge of Hopes?,To help children with special needs reach their full potential by offering tailored learning solutions.
What technology does Bridge of Hopes use?,Advanced AI to design adaptive learning experiences and monitor student progress.
What are the main features of the Bridge of Hopes platform?,A web-based teacher portal and a student app for personalized learning experiences.
How does the teacher portal help educators?,"It facilitates class management, activity creation, student progress monitoring, and communication with parents and staff."
What are some student-centric features of the platform?,"AI-driven learning, interactive puzzles, letter learning modules, and writing exercises."
What does AI-driven learning provide?,Personalized activities that adapt to each child's progress and learning style.
How do interactive puzzle activities help students?,They boost cognitive and problem-solving skills in an engaging way.
What is the purpose of letter learning modules?,To help children recognize and write letters through engaging activities.
How do writing exercises benefit students?,They enhance fine motor skills and writing proficiency through tailored tasks.
How does the platform incorporate research-based methods?,It uses evidence-based practices and updates its methods based on the latest research in special education.
What role do custom reports play in the platform?,They help in detailed assessments and planning for each child's educational progress.
How does the communication tool in the teacher portal assist educators?,"It allows teachers to stay connected with parents, support staff, and other educators for better collaboration."
What is the vision of Bridge of Hopes?,To create an inclusive environment where every child feels empowered to learn and grow with personalized learning paths.
What is the mission of Bridge of Hopes?,"To help every child reach their full potential, no matter their challenges, by providing inclusive and personalized learning experiences."
Who are the key contributors to Bridge of Hopes?,"Educators, developers, and social workers who work together to craft AI-driven, inclusive learning solutions for children with special needs."
How does Bridge of Hopes support children with special needs?,By offering engaging activities and tailored learning paths through an AI-driven platform to help children flourish.
How does Bridge of Hopes make an impact?,By partnering with organizations and leveraging cutting-edge educational research to support children and their families.
What are the four essential pillars of the Bridge of Hopes team?,"Team Leads, Expert Panel, AI Team, and Development Team."
Who are the team leads at Bridge of Hopes?,Dr. Anam Qureshi and Dinesh Dhanjee are the team leads.
What does the AI Team do at Bridge of Hopes?,They develop AI-driven solutions to create personalized learning experiences for children with special needs.
What is the role of the Development Team?,They work on building and improving the technology behind the Bridge of Hopes platform.
What is the goal of the Expert Panel?,"To provide guidance, research-based insights, and expertise in inclusive education for children with special needs."
Why was Bridge of Hopes created?,"To give back to society by creating opportunities for every child to learn and thrive, regardless of their challenges."
Who are the members of the Expert Panel?,"Saad Ismail, Muhammad Ahmed, Shakeeb Siddiqui, Saad Amin, Dr. Murk Marvi."
Who are the members of the AI Team?,"Dinesh Dhanjee (Lead), Abeer Aslam (Lead), Ali Soban, Ameer Hamza, Muhammad Danish, Muhammad Hasheem, Muhammad Ibrahim, Sarosh Irfan, Taha Ahmed (Lead)."
Who are the members of the Development Team?,"Samaha Rizvi (Lead), Muhammad Taha (Lead), Raahim Irfan, Dinesh Dhanjee (Lead), Abdullah Azhar (Lead), Anam Akhtar, Hammad Sharif, Hamdan Vohra, Muhammad Qasim, Syed Arqam Hassan, Sameed Jamal, Abdullah Edhi (Lead)."
What are the main team categories in Bridge of Hopes?,"Team Leads, Expert Panel, AI Team, Development Team."
What is the role of the Expert Panel?,They provide expertise and guidance to ensure the effectiveness of the platform for children with special needs.
What is the role of the AI Team?,They develop and improve AI-driven personalized learning experiences.
What does the Development Team do?,They work on the technical development and implementation of the platform.
How can I contact Bridge of Hopes?,You can reach out via phone at 021-111-128-128 ext. 140 or email at info@thebridgeofhopes.com.
Where is Bridge of Hopes located?,"St-4, Sector 17-D, NH 5, Karachi, Karachi City, Sindh, Pakistan."
How can I send a message to Bridge of Hopes?,"You can use the contact form on the website by providing your first name, last name, email address, organization/school, and your message."
Does Bridge of Hopes have social media links?,"Yes, they provide social media links to stay connected."
What is the purpose of the 'Write a Message' section?,"It allows visitors to send inquiries, feedback, or messages directly to Bridge of Hopes."
How soon can I expect a response from Bridge of Hopes?,They mention that they will get back to you soon after receiving your message.
Why should I contact Bridge of Hopes?,"You can contact them for questions, feedback, or to learn more about their initiatives."
What is the purpose of the 'Supportive Learning for Every Child' initiative?,"It customizes learning experiences to fit each child's unique needs, empowering children with special needs to thrive and reach their full potential."
How does the platform support children with dyslexia?,It provides customized reading exercises and visual aids to boost reading and comprehension abilities.
How does the platform help children with ADHD?,It offers engaging content and structured routines to improve focus and attention.
What kind of support does the platform provide for children with autism?,It includes tailored activities and interactive tools designed to enhance communication and social skills.
How does the platform assist children with Down Syndrome?,It provides interactive exercises to enhance the abilities of talented individuals.